{
  "run_id": "20260225-163848-m3",
  "milestone": "M3",
  "status": "running",
  "started_at": "2026-02-25T15:39:13.282Z",
  "updated_at": "2026-02-25T16:08:43.449Z",
  "issue_order": [
    92,
    93,
    94,
    95
  ],
  "current_issue": 94,
  "attempts_by_issue": {
    "92": 0,
    "93": 0,
    "94": 0,
    "95": 0
  },
  "completed_issues": [
    92,
    93
  ],
  "blocked_issue": null,
  "stop_reason": null,
  "issues": {
    "92": {
      "status": "committed",
      "attempts": 0,
      "note": "Issue #92 committed",
      "commit_sha": "b849dc4",
      "history": [
        {
          "status": "pending",
          "at": "2026-02-25T15:39:13.282Z"
        },
        {
          "status": "planning",
          "at": "2026-02-25T15:41:35.495Z"
        },
        {
          "status": "implementing",
          "at": "2026-02-25T15:52:35.778Z"
        },
        {
          "status": "verifying",
          "at": "2026-02-25T15:57:51.021Z"
        },
        {
          "status": "committed",
          "at": "2026-02-25T15:59:34.353Z"
        }
      ]
    },
    "93": {
      "status": "committed",
      "attempts": 0,
      "note": "Issue #93 committed",
      "commit_sha": "bffa2a0",
      "history": [
        {
          "status": "pending",
          "at": "2026-02-25T15:39:13.282Z"
        },
        {
          "status": "planning",
          "at": "2026-02-25T16:01:12.513Z"
        },
        {
          "status": "implementing",
          "at": "2026-02-25T16:05:20.621Z"
        },
        {
          "status": "verifying",
          "at": "2026-02-25T16:07:36.551Z"
        },
        {
          "status": "committed",
          "at": "2026-02-25T16:08:43.449Z"
        }
      ]
    },
    "94": {
      "status": "pending",
      "attempts": 0,
      "note": null,
      "commit_sha": null,
      "history": [
        {
          "status": "pending",
          "at": "2026-02-25T15:39:13.282Z"
        }
      ]
    },
    "95": {
      "status": "pending",
      "attempts": 0,
      "note": null,
      "commit_sha": null,
      "history": [
        {
          "status": "pending",
          "at": "2026-02-25T15:39:13.282Z"
        }
      ]
    }
  }
}
